{
  "$id": "https://raw.githubusercontent.com/sandialabs/sceptre-phenix/main/schemas/experiment.schema.json",
  "$schema": "https://json-schema.org/draft/2020-12/schema",
  "description": "A phenix Experiment config file (apiVersion phenix.sandia.gov/v1), checked as `phenix config create` checks it. Generated by src/go/tools/schema-export from the embedded OpenAPI schemas; do not edit.",
  "properties": {
    "apiVersion": {
      "const": "phenix.sandia.gov/v1"
    },
    "kind": {
      "const": "Experiment"
    },
    "metadata": {
      "properties": {
        "annotations": {
          "additionalProperties": {
            "type": "string"
          },
          "type": "object"
        },
        "created": {
          "type": "string"
        },
        "name": {
          "minLength": 1,
          "pattern": "^[a-zA-Z0-9_@.-]*$",
          "type": "string"
        },
        "updated": {
          "type": "string"
        }
      },
      "required": [
        "name"
      ],
      "type": "object"
    },
    "spec": {
      "$ref": "defs.schema.json#/$defs/Experiment"
    }
  },
  "required": [
    "apiVersion",
    "kind",
    "metadata",
    "spec"
  ],
  "title": "phenix Experiment config",
  "type": "object"
}
